{
  "$schema": "https://json-schema.org/draft/2020-12/schema",
  "$id": "https://bfds.local/schemas/surface-evidence.schema.json",
  "title": "BFDS Surface Evidence",
  "type": "object",
  "additionalProperties": false,
  "required": [
    "slug",
    "title",
    "confirmedAt",
    "productPath",
    "designPath",
    "surface",
    "changeType",
    "keep",
    "change",
    "avoid",
    "confirmation"
  ],
  "properties": {
    "slug": {
      "type": "string",
      "pattern": "^[a-z0-9]+(?:-[a-z0-9]+)*$"
    },
    "title": {
      "type": "string",
      "minLength": 1
    },
    "confirmedAt": {
      "type": "string",
      "format": "date-time"
    },
    "productPath": {
      "type": "string",
      "minLength": 1
    },
    "designPath": {
      "type": "string",
      "minLength": 1
    },
    "sourceSummary": {
      "type": "string"
    },
    "surface": {
      "type": "object",
      "additionalProperties": false,
      "required": ["name", "type", "currentSource", "confidence"],
      "properties": {
        "name": { "type": "string", "minLength": 1 },
        "type": {
          "type": "string",
          "enum": ["page", "route", "component", "region", "modal", "flow", "empty-state", "other"]
        },
        "route": { "type": "string" },
        "currentSource": {
          "type": "array",
          "minItems": 1,
          "items": {
            "type": "string",
            "enum": ["screenshot", "figma", "prototype", "url", "browser-capture", "storybook", "code-inference", "user-description"]
          }
        },
        "confidence": {
          "type": "string",
          "enum": ["verified", "user-confirmed", "code-inferred-unverified", "low"]
        },
        "evidenceRefs": {
          "type": "array",
          "items": { "type": "string", "minLength": 1 }
        }
      }
    },
    "changeType": {
      "type": "string",
      "enum": ["create", "extend", "modify", "remove", "replace", "merge", "restyle"]
    },
    "keep": {
      "type": "array",
      "items": { "type": "string", "minLength": 1 }
    },
    "change": {
      "type": "array",
      "items": { "type": "string", "minLength": 1 }
    },
    "avoid": {
      "type": "array",
      "items": { "type": "string", "minLength": 1 }
    },
    "confirmation": {
      "type": "object",
      "additionalProperties": false,
      "required": ["quote"],
      "properties": {
        "quote": {
          "type": "string",
          "minLength": 1
        },
        "confirmedBy": {
          "type": "string"
        }
      }
    }
  }
}
